{
  "audit_id": "ma_1752600000_a1b2c3d4",
  "target_url": "https://mobilistica.com/",
  "final_url": "https://mobilistica.com/",
  "audited_at": "2026-07-15T09:00:00.000Z",
  "strategy": "mobile",
  "platform": {
    "detected": "wordpress",
    "confidence": "confirmed",
    "evidence": ["wp-content/ path detected in HTML"]
  },
  "data_sources": ["psi_api", "html_fallback"],
  "mobile_score": 68,
  "performance": {
    "lighthouse_performance_score": 62
  },
  "core_web_vitals": {
    "lcp_ms": { "value": 2900, "rating": "needs-improvement" },
    "inp_ms": { "value": 180, "rating": "good" },
    "cls": { "value": 0.08, "rating": "good" },
    "tbt_ms": { "value": 320, "rating": "needs-improvement" },
    "fcp_ms": { "value": 1800, "rating": "good" },
    "si_ms": { "value": 3400, "rating": "needs-improvement" },
    "ttfb_ms": { "value": 620, "rating": "needs-improvement" }
  },
  "resources": { "total_requests": 84, "total_bytes": 2400000 },
  "images": { "unoptimized_count": 6, "modern_format_ratio": 0.3 },
  "javascript": { "unused_bytes": 180000, "render_blocking_count": 3 },
  "css": { "render_blocking_count": 2 },
  "fonts": { "external_font_hosts": 1, "font_display_missing": true },
  "third_party": { "scripts": ["googletagmanager.com", "google-analytics.com"] },
  "mobile_ux": { "viewport_ok": true, "tap_targets_issues": 2 },
  "commerce_ux": { "page_type": "product_detail", "add_to_cart_detected": true },
  "technical_seo": { "status": 200, "canonical_present": true, "title_present": true },
  "security": { "https": true, "hsts": false, "mixed_content": false },
  "recommendations": [
    {
      "issue_id": "perf-lcp-image-priority",
      "category": "performance",
      "priority": "P2",
      "title": "LCP画像にfetchpriority=highが未設定です",
      "evidence": ["LCP計測値: 2900ms（needs-improvement）", "ヒーロー画像にfetchpriority属性なし"],
      "business_impact": "モバイル表示の体感速度低下により、直帰・離脱が増え購入前の離脱につながる可能性があります。",
      "recommended_fix": "ヒーロー/LCP画像に fetchpriority=\"high\" と width/height を明示してください。",
      "implementation_owner": "frontend",
      "estimated_effort": "small",
      "confidence": 80,
      "automatic_fix_possible": false,
      "scores": { "sales_impact": 3, "mobile_ux_impact": 3, "seo_impact": 2, "cwv_impact": 4, "difficulty": 1, "cost": 1, "certainty": 3 },
      "platform_advice": { "wordpress": "テーマのheader.php／該当テンプレートで対象imgタグに属性追加。" },
      "term": "immediate"
    },
    {
      "issue_id": "seo-hsts-missing",
      "category": "security_headers",
      "priority": "P4",
      "title": "HSTSヘッダーが未設定です",
      "evidence": ["Strict-Transport-Security ヘッダーが応答に含まれていません"],
      "business_impact": "直接的な売上影響は小さいが、中間者攻撃リスクの軽減余地があります。",
      "recommended_fix": "Webサーバー/CDNでHSTSヘッダーを付与してください。",
      "implementation_owner": "server",
      "estimated_effort": "small",
      "confidence": 90,
      "automatic_fix_possible": false,
      "scores": { "sales_impact": 0, "mobile_ux_impact": 0, "seo_impact": 1, "cwv_impact": 0, "difficulty": 1, "cost": 1, "certainty": 4 },
      "platform_advice": { "generic": "nginx/Apacheの設定でHSTSヘッダーを追加。" },
      "term": "mid"
    }
  ],
  "summary": {
    "overall_score": 68,
    "grade": "C",
    "top_issues": ["perf-lcp-image-priority"],
    "executive_summary_ja": "モバイル総合スコアは68点（Cグレード）です。LCP画像の読み込み優先度設定が最優先の改善点です。"
  },
  "limitations": [
    "commerce_ux配下の一部項目（スクロール距離実測等）はHTMLヒューリスティックによる推定値です",
    "本結果はcli自己テスト用のモックデータです（MOBILISTICA_AUDIT_MOCK）"
  ]
}
